{
  "$schema": "../schemas/config.schema.json",
  "version": "2.1.0",

  "archive": {
    "enabled": true,
    "daysUntilArchive": 7,
    "maxCompletedTasks": 15,
    "preserveRecentCount": 3,
    "archiveOnSessionEnd": true
  },

  "logging": {
    "enabled": true,
    "retentionDays": 30,
    "level": "standard",
    "logSessionEvents": true
  },

  "validation": {
    "strictMode": false,
    "checksumEnabled": true,
    "enforceAcceptance": true,
    "requireDescription": false,
    "maxActiveTasks": 1,
    "validateDependencies": true,
    "detectCircularDeps": true
  },

  "defaults": {
    "priority": "medium",
    "phase": "core",
    "labels": []
  },

  "session": {
    "requireSessionNote": true,
    "warnOnNoFocus": true,
    "autoStartSession": true,
    "sessionTimeoutHours": 24
  },

  "display": {
    "showArchiveCount": true,
    "showLogSummary": true,
    "warnStaleDays": 30
  }
}
